评分,评论题目,用户名,时间,评论内容
6.0 / 10,"Liam Neeson played by Liam Neeson. You've seen it before. But, it's still entertaining.",MickandRorty,12 January 2018,"There are certain actors in Hollywood that are so one-dimensional, but they play that one-dimension spot on. Liam Neeson is one of those guys. Another example is Jason Statham. Their roles are all the same, scripts slightly tweaked, yet the movie passes of as decent-to-good almost every time (except for the Taken sequels, but that isn't on Liam).Bottom line is, it's basically the movie non-stop, but on a commute instead of a plane. Liam Neeson plasy his same old self and plays his usual one-dimensional badass role. He did his job once again. This movie will bring in okay-enough numbers, and we will be presented with Liam Neeson's next challenge in about another year.Same old, decent-enough action movie.6/10"
7.0 / 10,"""Non Stop"" on rails: thoroughly familiar yet thoroughly enjoyable",Paul Allaer,12 January 2018,"""The Commuter"" (2018 release; 103 min.) brings the story of Michael McCauley. As the movie opens, we get to know Micheal as he goes about his daily routine of waking up at 6 am and getting ready to take the commuter train in Manhattan, where he works at an insurance company. Then one day, out of the blue, Michael is fired from his job, for no apparent reason and just as he needs the money to pay for his son's expensive college. Afterwards he commiserates with a buddy (and that's when we find out Michael used to be a NYC cop). On his commute train ride home, Michael gets approached by a mysterious woman who makes him an offer: identify the person who doesn't belong on the train, and get $100,000 in return. She tells him there is a $25,000 upfront payment in the bathroom. When Michael goes to check there, he can't believe it but yes, there's the money. He decides to take it. It's not long before strange things start to happen... At this point we're less than 15 min. into the movie, but to tell you more of the plot would spoil your viewing experience, you'll just have to see for yourself how it all plays out.Couple of comments: this is, if I'm counting right, the 4th collaboration between Spanish director Jaume Collet-Serra and lead actor Liam Neeson, after ""Unknown"", ""Non Stop"", and ""Run All Night"". (Collet-Serra also directed the excellent shark-drama ""The Shallows"".) Just looking at these prior films, you know EXACTLY what you are signing up for if you decide to check out ""The Commuter"". In fact, this movie could be called ""Non Stop on Rails"". Just like that earlier movie playing out on the one air flight, much of ""The Commuter"" plays out on the one commuter train ride back to suburban NYC. If this sounds like like a negative, you might be wrong, as I was on the edge of my seat trying to figure out what the heck was going on (in the best possible way). One-time 'serious' actor Liam Neeson's transformation into one of the best and most reliable action movie stars is absolutely remarkable. He brings a certain weight and charisma into these roles that not a lot of action movie stars have. Keep an eye out for an all-too-rare sighting of Elizabeth McGovern (as Neeson'swife). Sam Neil has a small role as the Police Captain. Vera Farmiga is her usual great in the small role of the mysterious woman. But in the end, this is of course the Liam Neeson show all the way. ""The Commuter"" opened wide this weekend. The Friday early evening screening where I saw this at was not attended very well, and surely the inclement weather here in Cincinnati was a large factor in that. I was in the mood for something to entertain me, and ""The Commuter"" was just what the doctor ordered: thoroughly familiar, yet thoroughly enjoyable too. If you are a fan of Liam Neeson's action movies, you cannot go wrong with this one. ""The Commuter"" is a WINNER."
8.0 / 10,"Fun movie, worth seeing on a big screen with big sound",Dan Phillips,12 January 2018,"Neeson creates a likable, sympathetic character. This is necessary for the heightening of tension, which screws on inexorably until you just don't see any way out for him.The camera-work was particularly masterful - creative, meticulous, thought out to a granular level. There are two particular action-pieces towards the climax that are breathtaking, at least one of which looks like (but surely isn't) a single, extended take. The camera defines space and gravity, and is part of the expeience.Yes, there are some credibility straining factors. But it is after all a movie, not a procedural. On the other hand, there are some very neat surprises.Glad we saw it!"
,"You know the drill, but it still is a fun ride.",jdesando,10 January 2018,Warning: Spoilers
7.0 / 10,great action movie,Beth DeMatteo,14 January 2018,"Like the movie, usually like anything he is in. It was fast paced and kept you thinking but it always annoys the **** out of me when the staff does not do their homework on a movie. I always love places where they show errors that are not picked up in scenes before the movie is finally printed. My gripe here was the ending where the standoff occurred in Beacon NY with NYPD police in charge. Did noone tell them that NYPD has no standing in that area? Where were the NY state troopers?? Just knitpicking I realize but that is someone's job.."
7.0 / 10,This is what you get when amateur writers think they can write a screenplay,Harrison Tweed (Top Dawg),12 February 2018,"The directing was decent, the acting was great, the cinematography on point but the writing and screenplay by both amateurs Philip de Blasi and Byron Willinger is what ruined this movie. There were more plot holes and ridiculous scenarios (and lack of logical ones) than there were commuters on the full train at the start. How difficult is it with such a big budget and top notch Hollywood backers to allow such garbage writing ruin what could have been a great film. Too bad, not even Liam Neeson could save this one. A generous 7/10 from me"
7.0 / 10,"Nothing new from Neeson, in a good way (and a bad way).",liamhorsfall,13 January 2018,"If you've seen one Neeson film, you've probably seen them all. Despite having already mastered the art of playing the grizzled, independant tough-guy, Neeson is back with The Commuter, in which he plays an unsuspecting ... well ... commuter, who is drawn into a criminal conspiracy which could kill everyone on-board.It's a familiar sounding plot, but it's one that Neeson excels in, in fact, he may be too good at it by now. With all that said, The Commuter, much like Taken, Taken 2, Taken 3, Non-Stop, A Walk Among the Tombstones, Run All Night and Schindlers List, is another fun Neeson film which you'll probably enjoy much more than you'd be willing to admit."
7.0 / 10,Strangers on a Train,rbrb,11 January 2018,"This is a decent action-thriller movie.A long time train commuter is surprised by a stranger on a train with an enticing offer; after a bad day at the office the commuter is dragged into an ever spiraling dangerous ride.There is danger, suspense and intrigue.Ok so parts of the story may be far fetched but all the players give first rate convincing performances and aided by a distinct feel of realism during the train journey, these factors convinces me the movie deserves a solid:7/10."
3.0 / 10,"""This train is freaking me out"".",bob-the-movie-man,20 January 2018,"""The Commuter"" is not a good film. You know that I'm not a prude about action films: ""Die Hard"" is one of my all time favourites and I even gave this actor/director combo's previous outing - ""Non-Stop"" - a rather generous three Fads. But like many of my commutes, this is a hundred minutes of life that I won't get back again.Liam Neeson (""A Monster Calls"", ""Taken 3"") plays Michael MacCauley an insurance salesman (no, I'm not making it up) who of course used to be a police officer with a certain set of skills. With advancing years, a couple of mortgages to keep up and a son about to go to college, he is financially rather exposed.When a bad day turns worse, the commuting MacCauley is approached by a mysterious woman (Vera Farmiga, ""The Judge"", ""Up In The Air"") who offers him a financial bail-out for doing ""just one small thing"". No, it's not for sex in the toilet... it's to use his familiarity with the train and its normal passengers to find the person that 'doesn't fit there'. For there is a lot at stake and MacCauley is drawn into a perilous game where his own life and the lives of his son and wife Karen (Elizabeth McGovern, ""Downton Abbey"") are put at risk. What the inexperienced writers (Byron Willinger, Philip de Blasi and Ryan Engle (""Non-stop"")) were clearly shooting for was a Hitchcockian ""ordinary man in deep-water"" style flick of the James Stewart ""North by Northwest"" variety.... but they really miss this by a mile. With the 65 year old Liam Neeson - here playing 60 - performing acrobatics on, under and across an express train, belief is not just suspended - it is hung drawn and quartered! The action is just ludicrously unrealistic. The plot also has more holes than a moth-eaten jumper. Omnipotence of the villains is evident, but never explained, and while they are fiendishly clever in some aspects they are face-palmingly stupid about others. (No spoilers, but the threat to MacCauley's family is mind-numbingly foilable).A 'major event' at the end of reel two (if you've seen the spoilerish trailer you'll know what this is) leads - notably without any 'consequence' - into a completely ridiculous final reel that beggars belief. It also includes a ""twist"" so obvious that the writers must have assumed an IQ of sub-50.This is a film that melds ""Taken"", ""Non-stop"", ""Unstoppable"", ""Strangers on a Train"" and - most bizarrely and cringe-worthily - ""Spartacus"" to create a cinematic mess of supreme proportions. I put director Jaume Collet-Serra's last film - ""The Shallows"" - into my Top 10 films of 2016. He'll be lucky if this one doesn't make my ""Turkeys of the Year"" list for 2018.Avoid!"
6.0 / 10,Decent Thriller Derailed by Ridiculous Third Act,Fletcher Conner,15 January 2018,"The Commuter delivers what it promises, a Liam Neeson action movie that relies on tension and a little bit of mystery to fill out its runtime. It begins very well with minimal exposition for the set up, using images or short conversations to explain what most movies would carve out five minutes of dialogue for. From there it evolves more like a mystery with an ordinary man in an extraordinary situation searching for someone on the train. As it enters the third act, it goes full action movie with explosions, fight scenes, and massive stakes. While this was to be expected from Jaume Collet-Serra, it undermines what had been a more contained thriller up to that point.It is shot well enough and uses an ensemble cast well, but no one besides Liam Neeson really has too much to do. Vera Farmiga and Jonathan Banks are both talented actors that are really underutilized. All in all, The Commuter is another Liam Neeson action movie that could be best described as ""Nonstop on a train."""
7.0 / 10,"Part Hitchcockian whodunnit and part white-knuckle thrills, 'The Commuter' overcomes what it lacks in logic with well-executed suspense and action",moviexclusive,10 January 2018,"Hard to believe that it has been 10 years since Liam Neeson became an unexpected action star with the lean, spare but brutally effective thriller 'Taken', and in the decade that's passed cemented his late renaissance with well-executed B-movie fare like 'The A-Team', 'The Grey', 'Unknown', 'Non-Stop' and 'Run All Night'. The last three were also notable for being collaborations with director Jaume Collet-Serra, and the now 65-year-old has extended their team-up with 'The Commuter', which sees Serra further lay claim to a modern-day Alfred Hitchcock with a couple of high-wire scenes that would certainly make the latter proud.As with before, there is a high-concept scenario at the heart of this deliberately old-fashioned thriller: an everyday insurance salesman Michael McCauley (Neeson) finds his routine evening commute back home from work disrupted by the enigmatic stranger Joanna (Vera Farmiga), who sits opposite him on the Metro-North train and offers him a hefty financial reward if he is able to spot someone on the train who isn't a familiar face. In order for Michael to be tempted in the first place, first-time screenwriters Byron Willinger and Philip de Blasi set him up to lose his job on that same day, leaving him floundering over his two mortgages as well as tuition fees for his college-bound son - although because this is Neeson we're talking about, you know Michael will eventually do the right, honorable and even heroic thing.To up the ante, Michael is only given slightly more than half an hour before the train reaches Cold Spring to find the individual he is told later on goes by the name of Prynne; and to raise the stakes, it turns out that Joanna has also held his wife and son hostage, both of whom she threatens to kill if Michael fails to complete his mission. True to his Hitchcockian ambition, Serra spins an intriguing web of mystery over most of the middle act, and there are at least three riveting questions that are teased. Who is Prynne? Who is Joanna and/or the people she is working with or for? And finally, what does Joanna want with Prynne? These in turn translate into solid character work for the proverbial strangers on the train whom Michael probes to locate his mark - among them a feisty college student (Florence Pugh), an arrogant Wall Street banker (Shazad Latif), an emotionally distraught nurse (Clara Lago), a tattooed bruiser (Roland Moller) and a taciturn teenager (Ella-Rae Smith).Yet Serra is all too aware that a whodunnit in and of itself is unlikely to satiate a good proportion of his audience, who are here to watch Neeson engage in the sort of close-quarter fisticuffs a la 'Taken'. So in between playing detective, Michael also gets a couple of well-choregraphed brawls - one of them takes place in the confines between carriages, while another that is impressively done in a single take plays out over an entire carriage with everything from a gun, an ax, a guitar and seat cushions used as weapons. There is visibly concerted effort to keep these fight sequences real, so even though Neeson's character is revealed earlier on to be an ex-cop, the film doesn't (thankfully) use that as an excuse to gift him with ""a very particular set of skills"" to take down his opponents too easily, skilfully or neatly.Like other locomotive-set thrillers, this one doesn't escape without the train in question going out of control and then literally off the rails. That it is well-staged is undeniable - not even some subpar CGI in some shots can detract from the sheer white-knuckle tension of seeing almost the whole train flip into the air - but this spectacle-fuelled conclusion arguably strains the credibility of the high-concept movie even further, and is therefore both better and worse off for it. Notwithstanding, Neeson remains through and through the film's emotional centre, conveying the frustration, helplessness and resolve of a regular guy who is trying to get his life back in control from those that have snatched it away from him. Lest we forget, this is a role that the thespian can easily do in his sleep, but Neeson still brings his considerable gravitas to bear.Mind you, not all the gaps in the narrative will be filled in by the end (which seems to set up the possibility of a sequel) nor will some of the explanations pass muster under closer scrutiny. Still, a film like this isn't meant to be held up under such examination or intended to offer any more than solid B-movie guilty pleasures; on the latter count though, it does succeed brilliantly and beautifully by mixing classic Hitchcockian tension with adrenaline-pumping action. We dare say that it ranks among one of Neeson's best in his action oeuvre, and if you're in the mood for some pulpy thrills and suspense, then you'll definitely want to get on this train."
4.0 / 10,Partly quite good and partly extremely bad...,EskeRahn,10 January 2018,"Basically a good plot, good acting, a good bit of suspense, action and good effects, so how can this go wrong?Well parts of it is so ridiculous and stupid that it is hard to believe no one stopped it at the script level.. And parts are just 'over the top', sort of ""OK we have paid for effects, so now give us a truck load full"" - I was VERY close to leaving the theatre a couple of times....And this is really sad, as it could have been a good action thriller, as the ideas were good.I believe that cutting away the bad stuff that sums up to less than half an hour and replace a few minutes, and it could have been great in the genre!"
5.0 / 10,VIEWS ON FILM review of The Commuter,viewsonfilm.com,13 January 2018,Warning: Spoilers
4.0 / 10,Spoilers,hummam,19 January 2018,Warning: Spoilers
5.0 / 10,One Stop Ride,Thomas Drufke,15 January 2018,"I enjoy Liam Neeson action flicks as much as the next guy, but I also prefer say a Taken, The Grey, or Unknown over such films as Taken 2 or 3. In other words, it's as simple as saying I enjoy his action outings when they are a nice mix of fun thrills with serious overtones. To me, that's when he succeeds the most. The Commuter, which is supposedly his last action film, is a less than stellar film that revolves around another unbelievably silly (but plausible for a Neeson film) situation in which the 65 year old action star can flex his abilities.The problem I had with The Commuter was that it lacks the fun that some of Neeson's previous outings had. In large part, it mirrors another train thriller from a few months ago, Murder on the Orient Express. The mystery has some interesting twists and turns, but there just isn't enough action pizazz to keep it from being forgettable within days. In fact, I saw the movie yesterday, and I'm having some trouble remembering certain plot elements.There are some solid performances among some not so good ones. Neeson, Vera Farmiga, Patrick Wilson, Sam Neil, and Jonathan Banks do their best with a serviceable script to provide intriguing characters and plot developments that are nothing more than B-movie material. I guess that's probably the best way to describe this film, it's something that you could enjoy on a night home and scrolling through channel guide. But there's nothing nuanced or special about The Commuter. It's the prototypical January release.5.2/10"
9.0 / 10,Get on the train for THIS movie!,melliemulch867,15 January 2018,"I'm not a gifted movie reviewer like many on here (LOL), but I can tell you that my husband and I really enjoyed this movie! It's fantastic! Plenty of action and twists and turns. Great acting job by the cast and fantastic directing. This movie had me on the edge of my seat and grabbing my husband's hand. If you like suspense/action movies then you'll love this movie!"
7.0 / 10,Better than expected,nahas-marwan-453-338903,14 January 2018,"The movies is a suspense thriller that keeps you on the edge of your seat. Nothing very new or original, yet liam neeson sticks to his tried and tested formula which actually works. It's a fun movies don't over think it and you will enjoy."
8.0 / 10,A satisfactory thriller with a few distractions..........,kashidomar,10 January 2018,The movie is quite a good movie and i really think movie lovers should go at it . It is a thrill spiced movie with many suspenses and hidden turns in the story . The movie flows around a commuter train and builds all the potential actions and dramas around it. Nice to see Liam Neeson in the central role . He has done extremely well and he has delivered these stuffs to us for many times. Actions are pretty new and mindblowing. Action lovers will like it certainly. The only draw back is the monotonous story but the pace of actions and suspenses has overcome it at last . So my opinion is 8/10.
7.0 / 10,Another Frenetic Neeson Flick,3xHCCH,11 January 2018,Warning: Spoilers
3.0 / 10,This was a stupid movie,zsiga-53201,26 January 2018,"Being a big Liam Neeson fan took the girl to watch this in the theater on big screen wow the action scenes will look awesome! .. well sort of. The script is so stupid and contorted that even Neeson and Vera Farmiga's legs can't save it. Our hero is old and tired, trapped on a train, just got fired so desperate for the money, his adversaries know everything, can tap into phones, can kill everyone but they need to play this game with the hero. What a bs.I'm really surprised why Neeson took the contract he shouldn't go down the same path with Bruce Willis playing in B- movies. It was like watching a mild version of Steven Segal: Under Siege 2 without the action scenes."
8.0 / 10,Non Stop 2 -The Commuter,garytruffitt,6 February 2018,"If you enjoy Liam Neesan movies you should enjoy this. It's basically the movie Non Stop, but instead of a plane it's a train. Not much else to add other then I really enjoyed this movie"
8.0 / 10,"If you like Non Stop, you'll love this.",garytruffitt,6 February 2018,"I went to the cinema expecting to see a movie similar to Non Stop, and guess what. I was right. To be fair I don't know why they didnt just call this Non Stop 2 - The Commuter. That does not stop this from being a very good movie though. Neesan is at his very best in these sort of movies and it's no different here. The film has a very good cast and the pacing of the movie is near perfect. The only real negative is a scene which takes place later on in the film, Which lets it down a little, But other wise this is a very good movie."
3.0 / 10,Scrambled Mess,rioplaydrum,24 January 2018,"Fifteen minutes in and I had no idea what was going. Seriously.Convoluted plot, impossible dialog, very cliché CGI effects.Too many details and highly unlikely developments that over-pack a story which intends to impress and only achieves the opposite.The 'Mystery Woman' really got on my nerves. Her disembodied ubiquitous presence pops in and out on smartphones through out the train ride just to let you know she sees and hears all every second of the day and night.Right.Shortest review I've ever written.Pointless and unredeemable."
5.0 / 10,"Passable action flick, plenty of style but little substance",areatw,23 January 2018,"'The Commuter' is a stylish, well produced action movie but, as with many other films in this genre, it has a plot that fails to stand up to scrutiny. Far-fetched would be an understatement - it all feels very 'make it up as you go along', with no explanation given for much of what takes place on the train and an underwhelming ending that leaves more questions than answers.Plot aside, 'The Commuter' is a decent piece of entertainment, thanks largely to the high production value and Liam Neeson's compelling performance as the lead character. If you can zone out of the story and enjoy the fights, explosions and everything else that comes with a Liam Neeson action movie, then 'The Commuter' is a passable action flick, but nothing that hasn't already been done before."
5.0 / 10,See Only If You Like Stupid Conspiracy Crime Movies With Liam Neeson,AudioFileZ,21 January 2018,"If you're going to roll out Liam Neeson once more as the everyman terminator I guess you'll get a certain built-in audience which seems proven. What's the setup this time? Ahh, a aged man suddenly in a particularly vunerable state fighting for his family's safety usually makes one...check. Badguys who give you a mission you must complete to save your family to which you aren't sure who the badguys actually are...check. And everything important occurs on a train. Ahem, that's a blend of something akin to Hitchcock meets a bit of action. This could be interesting if the story line is perhaps?The Commuter takes a spotty murderous game and seeks to throw in enough reality with mysterious complications forgetting to question how ridiculous the actual game is. Since the baddies seem to know enough to assinate their target we're suppose to believe they need to preposturously manipulate Neeson's character instead. But why? The whole idea seems needlessly contrived.After watching the film I felt like the only reason I watched was to make more sense of something so wrong. Neeson plays the role with the right degree of desparation alright as he seems like a doomed ping-pong ball in his search for his target. He seems both on the edge as well as determined, with little chance of success. Of course we already know we must have him not fail and that waters an already confusing silly story.If Liam Neeson couldn't play this role so well this film would be, well, needless in most every regard. Admittedly there is something to seeing him constantly being a hair from disaster yet hanging on that is compelling. It doesn't really make any sense however and the ending feels totally as an ""Hail Mary"" attempt to tidy it all up. I really can't recommend it as sush."
5.0 / 10,Dead title dead storyline felt rushed and unbelievable,Bajyohface,21 January 2018,"They tried to do too much and it didnt work, not believable enough like taken unknown run all night non stop. Neeson is playing an old man in the movie. We don't realise but hes actually quite old for an action hero.
Its like they took good scenes from different movies and put it all together...Mixed it up...blended it...added liam neeson...overpromoted it and voila u got a dead movie. And im a neeson fan! Its got the same directors as non stop and run all night which were enjoyable movies. Although even in non stop, the last 20 minutes was rushed and solved too quickly and unbelievably. Sorry Liam. U r still the man but just not in this mpvie. I hate it when good actors do dry movies getting washed up in the process. Like Bruce willis"
