评分,评论题目,用户名,时间,评论内容
6.0 / 10,Derails off the tracks,Corey James,19 January 2018,"This review of The Commuter is spoiler free*** (3/5)LIAM NEESON COMES with baggage, that's inevitable after years of being caught in action thrillers that have both earned him a spotty track record but it's also given him a particular set of skills, these he can use to pull punches, kick a few people and even pull out a gun or two. Granted this may lead you to quote that infamous line from the first Taken - go ahead then, but it also means that he's never really boring even though some of his movies certainly are. 
 
Though his track record isn't all bad or all boring as he has, on occasion between franchises stepped over a few high peaks (The Grey, A Walk Among the Tombstones are worth the mention), but also in that time he's also stepped into a puddle of deep, deep mud (Battleship, Taken 2 and 3) and often it seemed that he would never really get away from that plot. So, yes this particular set of skills can get him out of some heavy sh*t, but sometimes that can be hard to get out of if indeed it's anything like Battleship. Still, he manages to stay entertaining and it's his many collaborations with director Jaume Collet-Serra that make him an entertaining asset to action. Firstly, Unknown (nobody knew him), next Non-Stop (he killed on a plane), and lastly in Run All Night (he saves his family from danger). However their fourth time as a duo The Commuter is indeed their best yet. Plot-wise it's like it is the sequel to Non-Stop, however his acting chops carry the film and he proves that he can play his way around some Hitchcockian twists. 
 
Here he has to chase a stranger on a train, in an effort to get information and the hitch is that he has to do it while on the train. Granted the plotting doesn't make much sense and the logic bomb detonates before the train leaves the station, but it's the dedication of Collet-Serra to work in small spaces and Neeson's will to raise the tension while finding this person. Also the murder mystery plotting sounds like an Agatha Christie adaptation, and sure in small doses it can be, though the train isn't as lavish as The Orient Express also the supporting players are nothing like that. Still what there is on offer for the supporters is another team-up with Vera Farmiga and Patrick Wilson except here they don't share any screen time together. In short, The Commuter isn't exactly a thoughtful thriller thanks to the workmanlike scripting but it is surprisingly entertaining and that is worth the watch.VERDICT Neeson is thrilling to watch in this surprisingly enjoyable if a little forgettable crowd-pleaser that takes you on a thrill ride - in more than just one way."
5.0 / 10,Just a one way ticket please,Grumphy,18 January 2018,"The CommuterStory is a bit. Well. What do you expect? It's a full on action flick. Though it has some redeeming moments, a few clever twists or turns can't save it from the banality that it promises (and delivers). To clarify, there are more not-quite-so-clever twists. Acting is okay. Though as of late, Liam seems to be doing mostly more action oriented projects for some reason, he has skills that he's acquired over a decently long career and know how to use them. Even if he has to play roles as inane as principled ex cop with money troubles on a train. His co stars, or co passengers, pull something around their own weight. They play their parts as they are, they're not really playing characters, with little time (or need) for development. The jerk is a jerk, the teenage girl is a teenage girl, the random friend is a random friend etc. Visually the film is laughable at times. It's not Scorpion King level bad, but the CGI is terrible. On the plus side, those moments add to fun. I guess. Also the camerawork tends to go overboard for no reason other than... I don't know. It looks cool? It might've if they wouldn't have mixed it with bad CGI. These sort of things tends to happen when you've got nothing to show. Fight screens are decent(ish).Sound or music wise I'm trying to remember if there is anything to comment. I can't think of anything so I'm putting it on the plus side. Emotions and atmosphere seem written, not to say forced. The director Jaume Collet-Serra was either offered a lot of money to do this or he is also very principled and does not negotiate with terrorists. He should, however, make an exception and try to negotiate with the producers, because this could've been a totally different kind of film. But everybody likes fireworks I guess. Even if they don't mean anything. Because they mostly don't. So you forget them soon after."
,Next Stop: Predictablity,george.schmidt,18 January 2018,Warning: Spoilers
6.0 / 10,"Nothing really new for Neeson, but still kinda fun",bigfatmouth-23883,16 January 2018,"I admit that Neeson's films are a bit formulaic, but it can still be a fun time to while away some time. He certainly doesn't break any new ground and his nemesis doesn't break much ground, either.Perhaps someone can clear something up for me regarding normal MTA -vs- commuter rail. Is it safe to assume that a commuter rail train leaving Penn Station would not be stopping at MTA stops in Manhattan? I'm not even from NYC, but I was fairly certain commuter rail lines wouldn't have their first stop until they were at least out of Manhattan. That really bugged me in this move."
9.0 / 10,Liam Neeson Rocks in This One!,TheTruthDoor,15 January 2018,"The Commuter is a rocking good time! Yes, it's a little over the top at the end...but it is still fun. Yes you have to NOT question parts of the logic (Liam Neeson working in an office selling life insurance...no way) but that is part of the fun of watching this film.The plot was very good and had some surprises in it even though most of the situations have been seen before. The sound and cinematography were excellent. Here I will sum up ""The Commuter"" for you: slow meaningful start, fun thrills in the middle, and a wild over the top ending. What fun!Go see ""The Commuter"", I promise you will not get ""Taken""! TheTruthDoor never lies!"
7.0 / 10,decent entartainment for a plot fitting the lead actor,antoniotierno,15 January 2018,"The story puts Liam Neeson through his violent paces for a fourth time, swapping out Non-Stop's plane for a commuter train and tossing in some financial anxiety for motivation. It's funny in a way, but packed with a lot of adrenaline and action scenes. The mystery is less a whodunit than a whogotit, the ""it"" being a bag containing something stolen that the owner is desperate to recover. If you don't think too hard about why Neeson gets brought in or how the baddies operate or what the point is, you may be able to enjoy it. At least until the final act, when the film goes off the rails. Overall the plot's unlikelihood is really excessive but acting is good, as usual when Neeson is involved."
7.0 / 10,Better than I expected!,Gavin Purtell,15 January 2018,"'The Commuter' is the 4th film directed by Collet-Serra starring Liam Neeson - and it's better than 'Non-Stop' (the one on a plane), but not quite as good as 'Unknown' (the amnesia one). Neeson is struggling to pull off looking even 60 (dyed hair doesn't hide it), but luckily there isn't as many stunts as 'Taken' here. Michael (Neeson) is an ex-cop who now sells life insurance - why'd he leave the force? Don't know. He does, however, commute into New York City via train every day.The first 30min is quite slow & scene setting (Wilson as his ex-partner, Neill as police captain, Banks as fellow train-buddy), before Joanna (Farmiga) sets a mystery in motion that slowly reveals itself. The film slowly picks up pace as more clues are revealed and the body count slowly, but almost plausibly rises (six in total, I think). There's a stand-off at the end, but it's still all over in 100min.I think because my expectations were so low, I enjoyed this more than I might otherwise have. The tension is built quite well, the score's good, the fight scenes are (mostly) realistic and the story, while far-fetched, is not totally unbelievable - some of the stunts are, but that's to be expected. Certainly nothing new or revolutionary, but an enjoyable action/thriller that doesn't outstay it's welcome."
7.0 / 10,Wild Train Ride,steve beard,15 January 2018,Warning: Spoilers
6.0 / 10,Perfect January Movie,RJBrez,15 January 2018,Warning: Spoilers
7.0 / 10,Liam Neeson is greater than,Jon Ochiai,14 January 2018,"Liam Neeson elevates ""The Commuter"". Again, Neeson is way better than the material of the movie. Paradoxically, Director Jaume Collet-Serra's ""The Commuter"" poses as an action movie, but is really more thriller that contains action in the narrative genre. The screenplay by Byron Willinger, Philip de Balsi and Ryan Engle is very slow going from the exposition of the set up. Too bad. ""The Commuter"" opens with the provocative premise. Mysterious beautiful Vera Farmiga's Joanna asks commuter train passenger Michael, played by Neeson, ""What kind of person are you?"" Michael we learn from the introduction and series of flashbacks is an Insurance Agent for a large firm in New York City. He is laid off from his job after 10 years of service. This could not have happened at a more inopportune time. Michael and his wife Karen, caring Elizabeth McGovern, are strapped financially having to take out 2 mortgages on their home to send son Danny, played by Dean-Charles Chapman, to Syracuse University in the fall. Michael is a good man. He was an NYPD Officer before retiring to work insurance. Patrick Wilson plays Alex, Michael's dear friend and former Police partner. Too bad McGovern isn't leveraged more here. It is nice seeing her again in movies. After his layoff notice and riding the Commuter train home, Michael sits with Joanna, who offers him $100K if he agrees to determine what passenger on this train doesn't belong. This is more than hypothetical inquiry. What kind of person is Michael? Well, we kind of know through Neeson's persona that he is the noble Hero. Too bad also, charismatic Farmiga is relegated to her voice on mobile phone calls as Michael seeks to solve this puzzle, and save the lives of both Karen and Danny. Neeson is strong as the Michael desperately uses his will, wits, and action skills to save his family in the structured web of lies and betrayal. The ""idiot plot"" is that Joanna should know better than to f with Michael. After all he is Liam Neeson. To that point ""The Commuter"" almost drags and tests your patience waiting for Neeson to unleash upon the villains. Almost. Neeson does deliver with both physical fury and gravitas. Again, he is way better than ""The Commuter"" itself. Unfortunately, having created an intriguing premise into human nature the movie forgets that morphing into a chase and discover narrative-kind of ordinary. Collet-Serra and his writers could have been more ambitious. Liam Neeson deserved better. In a sense so do we. ""The Commuter"" is good mostly, because of Neeson. However, even our Hero can only do so much. This is not a great movie. Yet, it is entertaining. This may have been greater with a little more care and intention."
7.0 / 10,Entertaining...,andrea_m_rodriquez,14 January 2018,"If you enjoyed the ""Taken"" movies, you should enjoy this one. Starts pretty slow, but picks up the pace 20-30 minutes into the movie. It was a good movie, forgettable and typical, but good. Worth a watch at least once."
7.0 / 10,Riding the Train To Mystery and Drama,rgkarim,13 January 2018,"
 Liam Neeson, a legend among the action/dram genre ever since Taken premiered years ago. Despite his best attempts, Neeson cannot seem to escape his typical role, and you know what... fans don't really seem to care. Fortunately, there has been some time lapse since his last escapade, but this weekend he is back in yet another intense movie called The Commuter. Looking to reprise his role once more, can this film triumph, or will it be just another copycat to be lost to the weekend. Robbie K is back with another review and also always thank you for reading. Let's go!LIKES:Mystery: A good mystery always suckers me into a movie and the Commuter has a hum dinger of one to solve. Upon entering the train and meeting Vera Farmiga, Neeson's character is dropped into the mystery with clues abound to choose from. One will have to pay strong attention to the details and dialogue to figure out all the answers, especially with many curve balls thrown in to try and lead you astray. That grand question of who done it, is the focal point of this entire movie, and the key factor to keeping you hooked in the movie. The Suspense: Of course a mystery can only go so far to keeping your interest. The Commuter has your back again on this, by keeping suspense intertwined with the mystery. Primarily through the pace, the Commuter moves at a fast pace to get you to the answers, taking only a few pit stops along the way to introduce a new dynamic into the mix. For once, I can't say there were any major scenes not needed, and with this storytelling, the intensity only deepened. Then come the actual threats and obstacles that further enrich the story, providing a little more depth to the usual plot that builds the intensity of the case, and keeping things relevant to the story. Add the finishing touches of dynamic cinematography with major sound editing and you've got yourself the successful recipe of another drama. The Climax: With all the epic build up promised in this movie, one only hopes the climax is able to meet the demands of the film. Fortunately, this film did not fail to please me with the ending at hand. Keeping with the energy of the film, the finale amped up the intensity with action, emotion, and a few twists to finally answer all the questions at hand. While there was a little convenient moment, the ending manages to bring everything together and leave you feeling fulfilled with true closure and what we can hope leaves no grounds for a sequel. DISLIKES:The Opening: While the Commuter gets to the suspense quickly, I can't say I enjoyed the rushed opening the film started with. A rushed montage that gave you brief glimpses into the life of Neeson's character clearly spell his life out, perhaps going a little too detailed in all aspects of his life. Ironically this approach left me a little bored and cheated of meaningful relationships with his family, you know the motivation for solving the crime, leaving me feeling he was the only one invested in the relationship. They even failed to show his family being kidnapped, and depriving of us the full emotional scale that we got with Taken. I do appreciate trying to get to the goods as soon as possible, but one must make sure to give that character some depth before testing them. Trailer Syndrome: Sadly, The Commuter suffers from the trailers giving a majority of the story away. While not all secrets are revealed, enough twists are shown in the brief 3 minute promotions to help you piece the movie together before it's even started. As if that weren't bad enough, one also can see those obstacles coming a mile away, making the movie become a bit more predictable and less intense. As it is the suspense and mystery that are key to getting the most out of this movie. If you avoid the trailers or are able to drop it out of their minds, no worries, but if you remember these like I do...get ready to be very familiar with these scenes. Semi-Rushed suspects: In movies like clue, and the original murder on the orient express, one become quite engaged in the stories of the those under suspect. However, The Commuter's cast are only semi-expanded upon in this movie and often in misbalanced proportions. Based on how often a character is used can certainly give you hints to their involvement, but these secondary characters are not well-integrated into the movie at times outside of some comedic relief. Sure, you get enough of their story to piece their struggles, but there was much more to be had. The VERDICT: The Commuter is a movie that I quite enjoyed, and is a welcome opening to what will most likely be more Neeson led dramas in the future. A strong mystery ties the action, suspense, and drama into a neat little package that builds up in intensity until the exciting climax emerges to wrap things up. Sadly, there are some editing tactics and semi-rushed development choices that take away from the character Neeson plays. Why they won't expand on his character and give him more depth I can't answer, but it would have been a plus if they had given him a little more to work with so he wouldn't be just another Taken knock off. Still, so long as you avoid the trailers, this movie is worth a trip to the local theater to entertain and tease your brain. My scores are: Action/Crime/Drama: 7.5 
Movie Overall: 6.5LIKES:--Mystery
--Suspense
--ClimaxDISLIKES:--The Opening
--Trailer Syndrome
--Semi-Rushed Suspects. The Commuter succeeds in providing you your Liam Neeson film fix for the next few months. While not an entirely remake of Taken, this film certainly has many similarities that take away from the uniqueness, but will please you. It has suspense and mystery to sweeten the pot, entangle with enough dramatic obstructions to try to deter him from uncovering the truth. Throughout the movie, one will certainly feel the intensity of the movie building, which is answered in spades by the incredible climax. Things will come full circle by the end of the film and the excitement will continue until near the last 10 minutes of the movie, which is something I can get on board with. 
 Sadly, this fast paced approach led to a b perhaps semi-rushed montage that added little to the film outside of quickly establishing his baseline. In addition, this approach crafted Neeson's character to be a bit shallower and boring in his quest to find the answers left bin that era. But when not concerned with the opening, the semi-rushed suspects and trailer syndrome will let you down and ruin many surprises that his movie needs to keep engaging. So bottom line for this is to avoid watching trailers for like the next two months. 
 Despite these areas of improvement though, The Commuter accomplishes it's goals and awaits further viewing by the public. I would recommend seeing this one due to all the mystery/music that graces it. If you decide to wait, please check out RedBox asap to enjoy this movie. My scores are:
Action/Crime/Drama: 7.5 
Movie Overall: 6.5"
8.0 / 10,Enjoyable ride,phd_travel,11 January 2018,Warning: Spoilers
8.0 / 10,Typical Liam Neeson movie!,allankaaber,15 January 2018,"Great action/suspense thriller with Liam Neeson. So if you like movies like Taken and Non-Stop, you should definitely watch this one.
You Will be sitting on the edge of your seat, while trying to guess what is going on and who are the people on the train. 
Liam is badass as ALWAYS! 
I was surprised to see danish actor Roland M03ller (under sandet) in this movie too.. He is onde of our best actors, and it's nice to see, that he has taken on the big screen in Hollywood. Roland M03ller Plays Jackson in the movie.
A very entertaining movie.."
4.0 / 10,This is a Bad One,statuskuo,15 January 2018,"Folks, this is a bad movie.
It starts off great, but crashes and burns towards the end. And it's heartbreaking, since the set-up is so strong.
Without going into plot, Liam Neeson is the best thing in this train wreck (see what I did?) He is a regular joe who is thrusted in a bizarre task of identifying a person on a train for this mysterious group. Very Hitchcockian, which downshifts into typical...and unbelievable commuter train crash. Neeson literally gets thrown from one train car to the next (was ridiculous in the first ""Mission Impossible"" movie). Even as a silly action film to switch your brain off, the big mistake it makes it to make it make sense. By that, I mean, filling in details of how the game was set-up. Luckily it was not a long flick and may be casual entertainment on a slow weekend. Be warned...this is a movie you walk out of where you shake your head confused as to the talent involved that would make something so flawed."
10.0 / 10,"Liam Neeson rocks. Awesome suspense, action n mystery.",Takethispunch,14 January 2018,"Insurance salesman Michael is on his daily commute home, which quickly becomes anything but routine. After being contacted by a mysterious stranger, Michael is forced to uncover the identity of a hidden passenger on the train before the last stop. As he works against the clock to solve the puzzle......"
2.0 / 10,A horrible movie - avoid at all costs,Dave Archer,14 January 2018,Warning: Spoilers
5.0 / 10,Liam Neeson Awesome as Always... but...,dantharpe,16 January 2018,"You are never disappointed with Liam Neeson... here's another great movie with an awesome storyline that keeps you on the edge.
The most frustrating thing about this movie is the beginning. The editing at the beginning creates entirely too much confusion and very hard to follow making it most unenjoyable to the point you think you've wasted money on a movie ticket.
However, once the poor editing settles down and the storyline begins to flow it grabs you and takes you on a ""train"" ride you will never forget!For new viewers, at the beginning hang in there... it gets better!"
5.0 / 10,"30% Taken, 30% Non-stop and 40% ""16 Blocks""",sdharmav,15 January 2018,"Just another Liam Neeson movie. It's like watching Taken, non-stop and 16 blocks all together. There is nothing new in story."
5.0 / 10,"Classic Neeson, passable entertainment",richardjehrenberg,14 January 2018,"Convoluted plot, nonsensical and illogical in ways.Loaded with technical faux pas. Would have been better if the writers or producer had resisted the temptation to inject a kiddie-oriented ""disaster movie"" type scene and not strayed from to the plot basics.Final scene must have been an afterthought, it was terrible.I will skip the details to avoid spoiling. No explanation or real conclusion - 'nuf said.If there's nothing else to watch...."
7.0 / 10,"A very similar ""Non-stop"" so nothing better",Iliescu Victor,13 January 2018,"Perhaps the first thing that stands out about this film is the similarity between it and its older ""sibling"" Non-stop (2014). The director's mark is noticed throughout the film and it's not entirely for the best.
I appreciated that Liam did a very good job, portraying an ex-cop with some fighting skills (as he got us used with) so with his current age in mind, only good words about that.
The bad things about this movie start with the very beginning, it's slow and takes a lot of minutes until things finally kick in. Not only that but throughout the film there are several scenes that makes you question what hour is it and how long until the movie ends (even though its roughly 100 minutes of runtime). 
The action scenes, which are quite a few, are well filmed most of the time and inserted when needed but some of them feel too forced and stupid. 
At times, I found myself feeling that I was watching Non-stop yet again, the plot and action being that movie: Liam is some sort of ex-cop/fed agent in a confined space, forced by bad guys to do something. 
The film is not great, it's a good action thriller with Liam Neeson, perhaps that's what makes this movie decent and worth to watch at least once."
5.0 / 10,Behind the Popcorn with Jacob Mello,thejacobmello,8 February 2018,"The last time I was treated to a ride that this closely paralleled The Commuter's velocity, originality, and overall thrill factor, I believe I was just outside of my local grocery store on a 25 cents per go, mechanical horsey ride. Still I have to admit, dignity aside, my day was slightly better because of it.Sitting just between good and bad on the spectrum, I suppose the polite euphemism for this movie is to say that it was ""familiar."" In fact, you could probably recreate this film, shot for shot, out of footage from other Liam Neeson movies. 
While it's my sincere hope that this Ikea version of film craftsmanship is a fad, I also have to acknowledge the fact that - though, The Network, this wasn't - they told us exactly what they were giving us in the trailer, and they delivered on that promise (unlike other shit-bomb murder on a train movies released in the last six months).The acting was good, the action wasn't bad and the story was decent (I know that because if it wasn't, they probably wouldn't keep recycling it film after film) but familiarity breeds boredom, and suffice to say, even first time moviegoers seemed to instinctively smell the silent but deadly twists and red herrings bubbling up before they were squeaked out into the stale theater air.If you've seen everything else, you might wanna give this one a try but otherwise just earmark it for a good Redbox rental to have on in the background while you clean-out your inbox in a couple months.And now, an open letter to all terrorists, murderers, kidnappers, and otherwise: I know it's not easy running a business that's largely opportunistic, especially in this climate. I know this is an industry where things can go wrong in a moments notice, leaving you with little else aside from improvisation; Shit happens. I get it - but threatening Liam Neeson's family is under no circumstances a good investment. Ever.Prescriptions
Go to the source: Watch the original TakenFor a better hostages caught in a conspiracy movie: Watch The Negotiator"
