评分,评论题目,用户名,时间,评论内容
6.0 / 10,Expected storyline with a little surprise at the ending,zhang wei,21 January 2018,Warning: Spoilers
4.0 / 10,Action-less plot guessing repeat,daniel_haddad,20 January 2018,"The Commuter (2018) is an action-packed mystery film without a lot of the action one would have expected given actor Liam Nesson's cinematic background recently. With several slow scenes and a drawn out story line, this is not one of Neeson's better films. The film is about a business man who is down on his luck and finds himself as a player in a crime conspiracy during his normal commute home. Nesson plays his traditional bad-ass ex-cop type role very well- though one has to wonder if he is tired of his one-dimensional characters. The story itself was rather slow and it seemed to be drawn out more than it should have been. There was little character development throughout the film and I was left wanting more from just about all of it. To be fair to writers Byron Willinger and Philip de Blasi, it is a challenge to have a 105 minute feature film set in essentially one location. They tried to do the most, however, the plot followed a generic story-line format of ""guy who is given a morally questionable task and then struggles with the decision of right and wrong"" and did not provide the big twist I would have expected in this type of mystery film. It once again, followed the generic plot twist one could have guessed about a third of the way through the film. Overall, The Commuter is not nearly as good as one would have hoped. Without a new and good plot, this action lacking film will not live up to most standards."
8.0 / 10,"They are really the directors of ""Non-Stop""",AMFCritic,20 January 2018,"If I had not seen ""Non-Stop"" before, this movie would seem much better to me. Because the theme is almost the same (same directors); but they change some things, still, I liked ""The Commuter"" and I think this is the best performance by Liam Neeson so far since the first ""Taken"".
In short, from the beginning ""The Commuter"" perfectly explains the life of the protagonist, the camera and the assemblies are spectacular and from the middle of the film to the end; It keeps you trapped, and leaves you wondering what will happen next? and (almost) always surprises with the twists in the story that manage to explain us in a good way the why is happening what is happening?"
6.0 / 10,Fun ride but could have been upgraded to first class,chrisjhembury,19 January 2018,"Liam Neeson reunites with action director Jaume Collet-Serra after working together on Unknown, Non-Stop, Run All Night now comes there latest Thriller (and Neeson's rumoured last action film) The Commuter. The story unfolds as Neeson plays the Insurance Salesman who on his daily commute home on the train is approached by a mysterious stranger (Vera Farmiga, Conjuring fame) to find a particular passenger who ""doesn't belong"" and he will get $100,000 in return. Shortly here after his life spirals into a chaos that makes Northern Rail look phenomenal. The two most successful parts of this production are the leading actor and the director. They know there stuff and smash the Action genre with great success. Neeson embraces the genre with ease, reliability and hops, skips and jumps (in some scenes really far) his way through the narrative that in recent years has given him such a successful platform. Image result for the commuter stillsThe Director strives to be as creative as possible instantly proving the trapped location of the train is no trap for his creative visual style creating cool SFX shots that keep the plot rolling with speed. Particular fun is shown taken setting the stage in the opening credits fast cutting his daily commute with footage of the hundreds of times his carried out this routine, with fast cutting and shot merges we learn allot fast, kicking us into the set stage. Image result for the commuter stillsThe let down really is the script that feels particularly rushed, what could have been a wicked Hitchcockian adventure like The Lady Vanishes on acid is replaced with a almost half thought out scenerio that needs much more time in the creative oven to have been developed.Great talented cast additions like Jonathan Banks (Breaking Bad) and Sam Niel (Jurassic Park) are given very little to do and their skills as actors are not rewarded by great dialogue either both have pretty unexciting lines to phone in."
5.0 / 10,Liam Neeson on a train!...and that's pretty much it for The Commuter; a typical January action thriller,RforFilm,19 January 2018,"It's January. I guess that it's time for another Liam Neeson action movie. Like the Saw movies we get almost every October or every may when we get a new Marvel movie, January has become something of a tradition to receive a new movie (usually an action or thriller) that stars Liam Neeson. This seems to have started thanks to the first Taken film that was put out at that time. It's certainly not because Neeson is desperate for work. He's a great actor who has shown to have a wide range and is still casted in big movies. I think even he's self aware of these kinds of movies.Counting Taken, Non-Stop, and Unknown, they all have gruff heroes that have to stop something. And they're all put out in January. Even when they come out as bad movies, they tend to do well at the box office. This shows that Neeson is still a draw and they like him as an action hero. He has the right mix of an everyman, but can also be as intimidating as a Schwarzenegger or a Stallone. How much longer can we enjoy this? I don't know, and The Commuter seems to show no sign of him slowing down.Insurance salesman Michael MacCauley (played by Liam Neeson) commutes daily on a train to New York. His routine is just like a lot of New York workers who don't live in the city. Despite this, he remains a big part of his wife Karen and teenage son Danny's life. His day is different this time as he's being laid off to cut cooperate costs. Before heading home, he catches up with his former police partner Alex (played by Patrick Wilson). Afterword's, he catches the same train home, though he'll have to figure out how to pay for his son's college tuition.While sitting, a woman Joanna (played by Vera Farmiga) tells him that there's a bag of money in the bathroom and he'll receive $75,000 if he does a favor of finding someone before the last stop in Cold Springs. Joanna gets off while Michael inspects to see if there really is money. He finds a bag, which sets him in motion follow the favor. When he tries to tell someone, Joanna (via someone else's cell phone) has the person injured and tells Michael he has to find a person named ""Prynne"". Between a hard place, Michael searches for this person while finding a way out. If you've seen Taken, Unknown, or Non-Stop, then you've already seen The Commuter. What I mean by that is The Commuter is exactly the kind of movie that comes out in January; bland, but has enough to not make it a complete failure. The story itself, while certainly interesting, doesn't have much potential. It's like those dime store detective stories. These are the kinds of stories that are written in a heartbeat while trying to figure out how to take advantage of Liam Neeson. Neeson is the best thing about the movie. His charisma makes him charming enough to make you want to follow him. You'll never believe he's playing a character, but that's usually common with his movies. What is lacking from the other movies are his action skills, but the man is in his mid sixties, so it's to be expected. That may explain the climax of the film, which does include a train crash. The problem is that it's CGI is so obvious and fake that it looks more like a cartoon then a live action thriller. The movie works a little more in it's first half, but not by a lot.I'll give this five train maps out of ten. Those that like Liam Neeson will probably find something they'll like whether it's the actor himself or maybe even the story. It's nothing special and even the movie is aware that it's nothing special. It's another escapist thriller. I'd say if your really curious, it's worth the DVD rental later on, but I wouldn't waste money on it in theaters. Check your schedule and see if The Commuter is worth getting on now or later."
6.0 / 10,"Fun, but unspectacular",bankofmarquis,19 January 2018,"If it's January, then it must be time for another Liam Neeson action flick.Enjoying a career renaissance as a tough guy action star, Neeson, again, teams with Director Jaume Collet-Sara to bring an above average action/adventure film that puts Neeson ""on his own"" against a group of bad guys. This time around, he's an ex-cop (of course) on a commuter train heading home. When a mysterious woman (Vera Farmiga) stops him and offers him $100,000 to identify a person on the train, Neeson must dust off all of his ""particular"" skills to identify the mystery person.I won't spoil the rest of the plot for you (what there is of it) for there IS some fun and unexpectedness to it. What is also unexpected is the sparse amount of action there is in this action flick. We spend a long amount of time wandering up and down the aisle of the commuter train while Neeson tries to deduce who this mystery person is. This it too bad, for Director Collet-Sara has shown in other Neeson action flicks like UNKNOWN, RUN ALL NIGHT and my personal favorite NON-STOP, he can do action well. So when the action happens in this film, it is fun to watch, there just isn't enough of it, for my tastes.The acting in these sorts of films is a secondary function, but everyone involved fill their roles professionally - starting with Neeson. He has this sort of tough guy action film star thing down by now and he does not disappoint here. You know what to expect from Neeson in these films - and he delivers exactly that. Joining in are such fun ""oh that person"" actors like Farmigia as the mysterious woman, Patrick Wilson as Neeson's ex-partner, Jonathan Banks as a fellow Commuter and Sam Neil as a Police Captain who might (or might not) be involved.All things considered, this is a fun, if unspectacular, action flick. Enjoyable enough to pass the time. Certainly one that if you run across it while channel surfing on your couch you should check out. Or...if you are looking for a few hours of escape during these dark days of January, you are in capable, competent hands with Neeson and co.THE COMMUTER is a ""B"" movie - and I'll knock it down a partial grade for not being ""action-y"" enough.Letter Grade: B-6 (out of 10) stars and you can take that to the Bank(OfMarquis)"
7.0 / 10,Good enough action thriller,hoangtranlovemanu,19 January 2018,"I didn't really expect too much from this movie because you know, it's Liam Neeson. The movie is not gonna be bad but it will not blow your mind either. The plot, the action scene, and pretty much everything else are all very stereotypical things in Liam's movie. However, kudos for the film for cutting right into the chase and keep the movie at fast pace. That keeps the movie still entertaining even though the concept is pretty maintream"
10.0 / 10,A who's doing it & why action thriller. CG fx fight scenes are a game changer!,tlooknbill,19 January 2018,"This movie has everything. I was thoroughly entertained.Original plot line, fight scenes that aren't just ass over elbows flying across the screen. Don't know how they did it but it shows actual fist to face contact of Liam getting his ass kicked. Very few viewer obscured camera angle trick shots. I could tell it was CG'ed but in a way that introduced blur that actually amplified the impact. A bit strange and unsettling effect that made me feel more sorry for Liam's character. The plot is intricate and believable. They do explain how Liam as an insurance salesman knows how to fight so they're not insulting the audience's intelligence. It all makes sense just like Liam's ""Taken"" movies. Grounded with a very mature tone, a welcomed respite from the current super hero venues. A lot of chess game strategic maneuvering that forces you to be fully engaged in who to trust and who's really behind the ordeal Liam's character faces. I'll be buying the Blu-Ray when it comes out. I do believe this is as good as ""Taken""."
6.0 / 10,"Entertaining enough, for a good 90 minutes.",Hellmant,19 January 2018,"'THE COMMUTER': Three Stars (Out of Five)Another Liam Neeson action-thriller, in this one he plays a badass insurance salesman who's drawn into a deadly criminal conspiracy on his daily commute home. The movie was directed by Jaume Collet-Serra, marking Neeson's fourth collaboration with the director (following 2011's 'UNKNOWN', 2014's 'NON-STOP' and 2015's 'RUN ALL NIGHT'). The film costars Vera Farmiga (who also starred in the director's 2010 thriller 'ORPHAN'), Patrick Wilson (who also costarred with Farmiga in two blockbuster 'CONJURING' films), Jonathan Banks, Elizabeth McGovern and Sam Neil. It's gotten mostly average reviews from critics, and it is another hit at the Box Office for Neeson and Collet-Serra. I enjoyed it to a certain degree.Michael McCauley (Neeson) was a dedicated insurance salesman for several years, until he's suddenly unexpectedly let go. After getting a few drinks, to drown his sorrows, Michael takes his regular commute home on the train. On the ride he's approached by a mysterious woman (Farmiga), who offers him $100,000 to identify an unknown passenger. At first Michael thinks it's just a game, but when he finds the money, and people start turning up dead, Michael soon realizes that everyone on the train is in great danger.The film is entertaining enough, for a good 90 minutes, and Neeson does what he does best in an action movie. Which isn't acting sadly, because acting is actually what he does best in a non-action film. He does make a good old action hero though, and this film pretty much plays out just like all of the other B action movies he's done over the years (especially the ones by this director). The plot is slightly interesting, and slightly involving, but the movie as a whole isn't one I'll remember much of a few years from now."
6.0 / 10,Leaves the Station without a Train of Thought,popcorninhell,19 January 2018,"In the realm of bruising, brawling, nay unstoppable a**-kickers, no rise is as unexpected and as unprecedented as that of Liam Neeson's. The man is 65-years-old and has worked on an incredible diversity of films, from gritty historical epics to talkie Woody Allen romantic dramas. But with 2008's Taken, Neeson took a hard dive into action and the world hasn't looked back since.Ten years after that franchise has remorsefully petered out, Neeson still turns in the goods every once in a while, with middle of the road action movies, middle of the road budgets and middle of the road returns. It's a living - I certainly don't fault the man who is pretty much getting paid to stay in shape. Plus every once in awhile, a middle of the road action movie is really all you need to stave off all the badness in this world.The Commuter is one such film. It's modest in its presentation and definitely falls to pieces under scrutiny but it nevertheless works because it knows what it is. It's the story of a seemingly ordinary New Yorker who ensnares himself in a criminal conspiracy on his way home from work. Luckily this man, one Michael MacCauley (Neeson), has a ""certain set of skills"" that will ultimately determine whether he lives or dies by the time the train reaches its final destination.The film was directed by frequent Neeson collaborator Jaume Collet-Serra who over the last decade has been a part of the best of Neeson's late-career work. With Neeson and Collet-Serra jointly you can expect a quick pace even tone, a good setup and a couple of action sequences that elevate the film above the field of a Van Damme knockoffs. You can also expect diminishing returns but more on that later.Part of The Commuter's nut-and-bolts appeal is it's sparse to a fault. We're put into our protagonist's headspace nearly the entire time, leaving only for a brief insert here and there. Michael is in search of a passenger on the train and needs to discover their whereabouts quietly. When who, what, where and why, in short, the details, remain scant keeping the audience transfixed on what is occurring. It's mystery box filmmaking at its finest.Of course after you've meticulously setup your premise and created the max level of tension, then you have to...you know answer the who, what, when and why. To that end The Commuter derails with the force of a backyard axe kick with villains who neither need to be this flamboyant nor this dramatic. For me, my suspension of disbelief snapped back the moment we get a cutaway of two FBI agents puttering around the last stop. But if you're the type of person who'd willingly set your house on fire to kill a spider then you're probably willing to forgive most of this film's baked in nuttiness.The movie is also hacked to s**t with editing choices that completely eschew any hope of any B-story. That normally wouldn't be such a problem if it wasn't immediately clear all that stuff was supposed to be there to begin with. For example, minor characters are enshrined in the last act with a working-class dignity reminiscent of the rebel slaves of Spartacus (1960), but absolutely nothing comes before it to ground us in whom they are. It's the equivalent of starting a children's storybook with the message on the last page being read first. Also, not for nothing but if you're going to directly reference an objectively great movie; please make sure your movie reaches at least a level of competence that you can find in a Harold Becker movie - just saying."
8.0 / 10,Liam Neeson was good but just time for a break,celigirl100,19 January 2018,"He act this one good like mostly his good scene with Taken , part 2 and 3 . I expected more in this one without he beaten up a lot but I guess the director is tell him time to park him as side he . He is wash up not moving like before so that's why they give him this piece . Am sorry if I offend you Mr. Neeson but that's what most of these director doing now a days to get rid of you. Best use start to produce movies but still keep your body fit. Am surprise they didn't give Bruce Willis this movie to act he always like to be blood in his moives and get bear up lol. I watch your movie tonight and it was still awesome thank for making your fans happy ."
,Great Start NONSENSICAL Finish... WTF?,Jaque (ScottBang),19 January 2018,"I feel bad for Liam Neeson. He never could match what he achieved with ""Taken"" despite attempt after attempt. When the movie had finished all I could think of was what the hell happened to that script? The skeleton for a great film is in place and the first act was intriguing and extremely riveting. By the time it ends, everything descends in to utter nonsense. It's as if the writer of this film took months to craft half the movie and then the studio called and told him he had 48 hours to finish so he slapped together the second half jacked up on caffeine and doughnuts. Either that or his 12 year old son snuck in to his office and finished it for him. It's like the writer had no idea where this was going to start and it went out of control and veered off the tracks... quite literally. What seemed like a clever lead character turns out to be a near buffoon. The twists are obvious and everything feels like a wasted opportunity."
7.0 / 10,A Fun Thriller With Excellent Acting And Camerawork,rannynm,19 January 2018,"The Commuter is a fun thriller, even if it does get a little too over-the-top for its own good. The acting and camerawork provide a tense feel to this movie, like many Hitchcock films. This is sure to please Liam Neeson fans.The story follows insurance salesman Michael (Liam Neeson), who is caught in a criminal conspiracy on his daily commute. Michael meets the enigmatic Joanna (Vera Farmiga), who will give him a large sum of money if he finds a passenger with evidence against her. This must be done before a certain train stop. This leads to a frenetic chase to find the passenger, as elements of the conspiracy are revealed. Michael happens to be an ex-cop and will do anything to protect this passenger, but this comes with consequences.Liam Neeson, as Michael, excellently presents his frantic need to find the passenger because every wrong move can result in an innocent passenger getting caught in the crossfire. He is spectacular in the fast-paced action and stunts. Vera Farmiga as Joanna, is my favorite character because of the intense threat and urgency she provides with her performance. It is also interesting to find out more about her conspiracy. Patrick Wilson, as Alex, is an incredible helper to Michael, but you can tell he has some secrets he's not sharing. Jonathan Banks, as Walt, presents a friend to Michael who commutes with him every day, while also helping him out.Jaume Collet-Sera wonderfully directs this film with a rapid pace and you feel you are a part of the train. My favorite scene is a one-shot fight scene on board the train, because of its impressive camera work. I also like how intense it is, due to the crowded environment. My only problem with this film is that, while the main story is extremely interesting, there are many over-the-top scenarios, which turn the movie into unintentional comedy. Also, some of the filming and editing feels rushed in places.The message of the movie is that doing the right thing will never be easy, but could result in the lives of many being saved. Despite his good intentions, Michael is put into one risky situation after another and he always must risk his life. However, he saves many through his selfless acts. I give this film 3.5 out of 5 stars and recommend it for ages 10 to 18, because of its intense action and language. Reviewed by Arjun N., KIDS FIRST! Film Critic. "
7.0 / 10,Very Detective and Thrilling action...you mnever know what's coming,yudiaibi,18 January 2018,"Hey guys, so i just did this movie recently and i have to get this movie a credit...why?
for simple reason i just do with numbering..1. Great Liam neeson act...similar with Taken or othe liam movies
2. remind us the same characteristic movies "" Murder on the Orient Express"" same detective kinda movie and catch our curiousity
3. Bad ass action Liam Standard
4. Makes you wanna know who the villain are
5. Hardwire in my mind during movies...make everyone goes with their own ending theory
6. fun fact is , there is one scene that i think already the ending of the films but actually just opener for a unexpecting result
7. The ending is so nice and make us wonder what the meaning "" the badge "" that liam give to joanna....
8. Very entertaining overallnice liam in your age you still did that kind of moves, that cool..."
7.0 / 10,Another Cool Liam Neeson Action Thriller Movie,mikenontonmulu,18 January 2018,"What was wonderful about seeing Liam Neeson was that he had such a commanding presence on screen that it felt whenever he was in a movie playing a tough guy, he really nailed it. In here, he played a character who was being suppressed so hard that he had no choice but to fight back, and boy he really fought.As usual, he would be able to do the fight skillfully but not in the very fast style a la Jason Statham or Donnie Yen but his own style which was brutal and kind of like a street fight. In here, all the fights done were good, but my most favorite would definitely be the one in the small compartment before the final stop. Apart from the cool fight scenes, there were also various intense moments involving the train. The train's high speed sequence towards the end was absolutely breath taking and so intense that I was literally holding my breath. And I know my wife also screamed a little during some of those awesomely done intense moments.For a movie that was shot mostly in a confined space of a train, the early part of the film was a bit too long to my personal opinion. This resulted to a bit of a slow pace at the start. Not until the scene in the train did we feel the movie picking up the pace. Personally I think that if the earlier part was made a bit shorter, the movie would have been a nonstop thrill. To tell you the truth, I also felt a bit of similarity with another Liam Neeson's movie Non-Stop where the scenes were mostly done in an airplane. This should not come as a surprise since both were directed by the same person Jaume Collet-Sera who also directed few other Neeson's movies such as Unknown and Run All Night. I found that the sound effects of the movie was excellent and the special effects were good. It also provided us some twists and an interesting plot of finding out who the person was which kept us guessing till almost the end. The opening sequence was uniquely done but may seemed a bit confusing first, though after a while you would understand it better. The movie's main attraction would definitely be Liam Neeson who already built up a rapport for being an action star even at his age. I pretty much enjoyed the movie as it was truly entertaining though I would have loved it more had the intensity started a lot earlier. Overall it was a good entertaining movie, and one that should be enjoyed as an action thriller film.So if you are a fan of Liam Neeson and want to see his collaboration with Jaume Collet-Sera again, then this should be a definite choice. If you like this kind of genre, you would surely be entertained. And it is worth to note that during this Award period in January where the movie options were limited to heavy drama (or a horror movie), then this could be a good alternate movie.For my complete review, pls have a look at michaelnontonmulu.blogspot.co.id"
7.0 / 10,Not Your Average Ride Home,david-sarkies,17 January 2018,Warning: Spoilers
