地区,行业领域,公司名称,行业,公司规模,网站,公司评分,月薪
厦门,专业服务,天健正信会计师事务所,财务/审计/税务,20-99人,www.ascendacpa.com,2.7,￥4740
厦门,专业服务,合诚工程咨询股份有限公司,咨询,100-499人,,3.4,￥3200
厦门,专业服务,易法通,法律,20-99人,,3.5,￥4250
厦门,专业服务,厦门澳诚因私出入境服务有限公司,财务/审计/税务,20-99人,aochengvisa.com,5.0,￥4655
厦门,专业服务,厦门莲桥企业管理咨询有限公司,咨询,20-99人,www.lotus-bridge.cn,4.0,￥5000
厦门,专业服务,厦门易帆人力资源咨询服务有限公司,人才服务,20-99人,www.yifanhr.com,暂无,￥3200
厦门,专业服务,厦门昌满顺金融技术服务有限公司,外包服务,,,1.0,￥4350
厦门,专业服务,新加坡印咨询集团,咨询,100-499人,www.epfuture.com,暂无,￥8621
厦门,专业服务,厦门维尔斯人力资源管理有限公司,人才服务,100-499人,www.weshr.cn/about1.asp?id=1,4.0,￥10625
厦门,专业服务,厦门创道企业管理咨询有限公司,咨询,20-99人,www.0592cd.com,暂无,￥0
厦门,专业服务,泛亚人力,人才服务,100-499人,www.fanyuanwang.cn,3.0,￥4224
厦门,专业服务,厦门市达人企业管理咨询有限公司,财务/审计/税务,100-499人,www.xmdr.cn,5.0,￥4450
厦门,专业服务,厦门外服人力资源服务有限公司,人才服务,www.xiamenzp.com,,暂无,￥0
厦门,专业服务,银石猎头,咨询,20-99人,www.silverstonehr.com,暂无,￥0
厦门,专业服务,开锐咨询,咨询,,,4.1,￥4000
厦门,专业服务,厦门赢在仁才人力资源服务有限公司,人才服务,100-499人,www.winrc.cn,暂无,￥15687
厦门,专业服务,厦门加捷股份有限公司,财务/审计/税务,100-499人,,3.5,￥2500
厦门,专业服务,厦门好未来教育咨询有限公司,咨询,20-99人,www.hwljy.com,暂无,￥3960
厦门,专业服务,厦门英斯捷企业管理顾问有限公司,咨询,100-499人,www.insgems.com,3.0,￥2880
厦门,专业服务,厦门酷启人才服务有限公司,人才服务,20-99人,www.kq36.com,暂无,￥7000
厦门,专业服务,厦门兰盾商标事务所有限公司,咨询,0-20人,,暂无,￥0
厦门,专业服务,厦门义华信会计师事务所,财务/审计/税务,100-499人,www.yhxcpa.com,暂无,￥0
厦门,专业服务,厦门市博格管理咨询有限公司,财务/审计/税务,20-99人,www.bossway.com.cn,3.0,￥0
厦门,专业服务,厦门枫华加威投资咨询有限公司,咨询,100-499人,,暂无,￥3160
厦门,专业服务,厦门澳家华因私出入境咨询服务有限公司,咨询,20-99人,,1.0,￥3993
厦门,专业服务,北京外企人力资源服务厦门分公司,人才服务,20-99人,www.fesco.com.cn/,5.0,￥3100
厦门,专业服务,盛世德才,咨询,20-99人,,4.5,￥14000
厦门,专业服务,科大慧明企业管理咨询机构,咨询,20-99人,,3.0,￥0
厦门,专业服务,厦门嘉维世纪会展服务有限公司,咨询,20-99人,,5.0,￥2268
厦门,专业服务,厦门译语翻译服务有限公司,翻译,20-99人,www.language-trans.com,3.0,￥3125
厦门,专业服务,厦门千夏软件,外包服务,20-99人,www.qianxx.com/,5.0,￥4500
厦门,专业服务,厦门商集企业咨询有限责任公司,咨询,www.onlyou.com,,2.8,￥9000
厦门,专业服务,福建东融律师事务所,法律,20-99人,,暂无,￥5650
厦门,专业服务,开锐管理咨询有限公司,咨询,20-99人,,2.3,￥6588
厦门,专业服务,厦门港湾监理咨询有限公司,咨询,100-499人,,2.5,￥4107
厦门,专业服务,厦门加捷正大会计师事务所,财务/审计/税务,100-499人,,暂无,￥1996
厦门,专业服务,检测公司,检测/认证,20-99人,,4.5,￥5655
厦门,专业服务,厦门科德特管理咨询有限公司,财务/审计/税务,20-99人,,3.0,￥3630
厦门,专业服务,零点企业策划,咨询,20-99人,www.xmzero.cn,暂无,￥3160
厦门,专业服务,厦门立伦营销策划有限公司,咨询,20-99人,www.xmlilun.com,暂无,￥3583
厦门,专业服务,厦门金海岸房产服务有限公司,财务/审计/税务,0-20人,,4.0,￥2225
厦门,专业服务,厦门中锐企业咨询管理公司,咨询,,,3.0,￥3057
厦门,专业服务,希格玛会计师事务所,财务/审计/税务,0-20人,,2.0,￥3979
厦门,专业服务,安利达信息咨询有限公司,咨询,,,暂无,￥3321
厦门,专业服务,厦门市御有企业管理咨询有限公司,咨询,20-99人,,4.0,￥0
厦门,专业服务,冠军企管咨询,财务/审计/税务,20-99人,,暂无,￥3321
厦门,专业服务,富邦兴业投资(集团)公司,咨询,20-99人,,3.0,￥6060
厦门,专业服务,厦门市新景祥房地产策划代理有限公司,财务/审计/税务,20-99人,www.xinjingxiang.com,暂无,￥6225
厦门,专业服务,厦门中科智业人力资源有限公司,人才服务,100-499人,,2.0,￥3975
厦门,专业服务,厦门明启商标事务所有限公司,财务/审计/税务,20-99人,,暂无,￥3312
厦门,专业服务,中科智业人力资源有限公司,人才服务,,,暂无,￥3523
厦门,专业服务,金老师教育咨询有限公司,咨询,20-99人,,3.0,￥2292
厦门,专业服务,厦门希尔企业管理咨询有限公司,咨询,20-99人,,3.5,￥5778
厦门,专业服务,厦门如意三宝咨询有限公司,财务/审计/税务,100-499人,www.rysb88.com,暂无,￥4465
厦门,专业服务,世贸企业咨询有限公司,咨询,100-499人,,暂无,￥2383
厦门,专业服务,厦门市名一商标事务所有限公司,咨询,0-20人,,暂无,￥6500
厦门,专业服务,北京大成（厦门）律师事务所,法律,20-99人,,暂无,￥4682
厦门,专业服务,福建天行健企业管理顾问有限责任公司,咨询,,,暂无,￥3458
厦门,专业服务,成才咨询公司,咨询,,,暂无,￥4898
厦门,专业服务,厦门草本生活健康咨询中心,咨询,20-99人,,暂无,￥2106
厦门,专业服务,大信会计师事务所(特殊普通合伙)福建分所,财务/审计/税务,20-99人,,4.5,￥2500
厦门,专业服务,厦门卓斯瑞咨询公司,咨询,0-20人,,5.0,￥0
厦门,专业服务,厦门卡森企业管理咨询有限公司,财务/审计/税务,20-99人,,暂无,￥3625
厦门,专业服务,厦门维尔斯,咨询,20-99人,,暂无,￥7689
厦门,专业服务,厦门嘉杰科技咨询服务有限公司,财务/审计/税务,20-99人,,暂无,￥2383
厦门,专业服务,大成律师事务所厦门分所,法律,20-99人,,4.0,￥4590
厦门,专业服务,立信会计师事务所厦门分所,财务/审计/税务,0-20人,,3.5,￥1896
厦门,专业服务,厦门普和会计事务所有限公司,财务/审计/税务,20-99人,,3.0,￥2610
厦门,专业服务,厦门奉达建筑设计咨询有限公司,建筑设计,,,暂无,￥3939
厦门,专业服务,南德认证检测（中国）有限公司,检测/认证,100-499人,,暂无,￥6114
厦门,专业服务,福建衡兴明业律师事务所,法律,20-99人,,暂无,￥2900
厦门,专业服务,厦门世纪领航管理咨询有限公司,咨询,20-99人,,3.0,￥5031
厦门,专业服务,领航管理咨询有限公司,咨询,20-99人,,4.0,￥0
厦门,专业服务,智联招聘厦门分公司,咨询,1000-9999人,,4.0,￥3625
厦门,专业服务,厦门绿之素环境与食品安全检测有限公司,检测/认证,20-99人,,暂无,￥4887
厦门,专业服务,厦门新格品牌管理机构,咨询,20-99人,,暂无,￥2990
厦门,专业服务,厦门财富知识产权有限公司,咨询,20-99人,,暂无,￥2940
厦门,专业服务,华夏经纬财务咨询(厦门)有限公司,财务/审计/税务,20-99人,,暂无,￥3328
厦门,专业服务,鹰博（厦门）企业管理咨询有限公司,咨询,0-20人,,5.0,￥3625
厦门,专业服务,新加坡印集团咨询公司,咨询,500-999人,,1.0,￥1015
厦门,专业服务,厦门纵横建设监理咨询有限公司,咨询,,,暂无,￥3036
厦门,专业服务,厦门联合信实律师事务所,法律,100-499人,,暂无,￥4350
厦门,专业服务,厦门富兰克林投资管理有限公司,咨询,100-499人,,暂无,￥8250
厦门,专业服务,厦门市中锐企业管理咨询有限公司,财务/审计/税务,20-99人,www.xmzhongrui.com,4.0,￥5150
厦门,专业服务,厦门会计事务所,咨询,0-20人,,暂无,￥3785
厦门,专业服务,厦门行动成功企业管理有限公司,咨询,0-20人,,3.0,￥1450
厦门,专业服务,精艺达翻译服务,翻译,20-99人,www.xmmaster.com,暂无,￥3989
厦门,专业服务,厦门均和房地产土地评估咨询有限公司,咨询,20-99人,,暂无,￥5940
厦门,专业服务,维尔斯人力资源管理有限公司,人才服务,100-499人,www.weshr.cn,暂无,￥0
厦门,专业服务,希格玛会计师事务所有限公司厦门分所,财务/审计/税务,,,暂无,￥0
厦门,专业服务,大英智(厦门)教育咨询有限公司,财务/审计/税务,20-99人,,暂无,￥2850
厦门,专业服务,厦门达融律师事务所,法律,,,暂无,￥0
厦门,专业服务,福建英合律师事务所,法律,20-99人,,暂无,￥2900
厦门,专业服务,厦门维尔斯猎头,人才服务,,,暂无,￥0
厦门,专业服务,厦门联合天衡律师事务所,法律,20-99人,,暂无,￥8110
厦门,专业服务,厦门圆方财务咨询有限公司,咨询,0-20人,,暂无,￥2030
厦门,专业服务,福建法正联盟律师事务所,法律,20-99人,,暂无,￥3625
厦门,专业服务,厦门合诚工程检测有限公司,检测/认证,,,暂无,￥2450
厦门,专业服务,厦门富斯特有限公司,咨询,20-99人,,暂无,￥0
厦门,专业服务,厦门京诚诚商务顾问有限公司,咨询,20-99人,,暂无,￥2310
